{
  "schema_version": "agx.bundle/v2",
  "bundle_id": "agx-plugins-20260819.1",
  "mode": "production",
  "provenance": "github_release",
  "development_override": false,
  "compatibility": {
    "agx": ">=0.1.0 <0.2.0"
  },
  "sources": {
    "agent_plugins": {
      "upstream_repository": "zaurakworks/agent-plugins",
      "distribution_repository": "2233admin/agent-plugins",
      "release_tag": "agx-plugins-20260819.1",
      "commit_sha": "ef07a9fd530ebac1b85eb5b9511ebd6742d743ee",
      "asset_name": "agent-plugins-agx-plugins-20260819.1.tar.gz",
      "download_url": "https://github.com/2233admin/agent-plugins/releases/download/agx-plugins-20260819.1/agent-plugins-agx-plugins-20260819.1.tar.gz",
      "asset_sha256": "d1ae80cebb7eb84c53e8d7f5b8af2f60786721219b492b5a8975e66442fbc97e",
      "content_sha256": "c752241575cabe79018c9dc990d2425e1ecd6ac03c88799050fd5b579f32aa21"
    }
  },
  "templates": {
    "version": "bootstrap-20260819.1",
    "content_sha256": "66b4db310377e9dfb173b3e39f4bc54665313ad2c4f6ee80602e941ea453e005",
    "references": {
      "agent_plugins": {
        "repository": "zaurakworks/agent-plugins",
        "commit_sha": "ad07742ade0f0039ed1df1a9262e8f087117fca0"
      },
      "agent_control": {
        "repository": "zaurakworks/agent-system",
        "commit_sha": "b0e6e0e8244ef518f671e2326745cd67c6d2307a"
      },
      "agent_contracts": {
        "repository": "zaurakworks/agent-contracts",
        "commit_sha": "5bb8ea0b54f063b0758c294b73ea270ba69322d2"
      }
    }
  }
}
